{
  "specVersion": 1,
  "name": "Minimal task harness",
  "brain": {
    "policy": {
      "type": "min_cost",
      "qualityFloor": 0.8
    }
  },
  "mission": {
    "kind": "task",
    "goal": "Summarize the weekly report",
    "doneDefinition": "A summary under 200 words exists"
  },
  "superpowers": [],
  "memory": {
    "enabled": false
  },
  "rules": [],
  "fuel": {
    "maxUsdPerRun": 0.5,
    "hardStop": true
  },
  "checkIns": [
    {
      "trigger": "before-external-action"
    },
    {
      "trigger": "before-external-action"
    },
    {
      "trigger": "before-external-action"
    },
    {
      "trigger": "before-external-action"
    },
    {
      "trigger": "before-external-action"
    },
    {
      "trigger": "before-external-action"
    },
    {
      "trigger": "before-external-action"
    },
    {
      "trigger": "before-external-action"
    },
    {
      "trigger": "before-external-action"
    },
    {
      "trigger": "before-external-action"
    },
    {
      "trigger": "before-external-action"
    },
    {
      "trigger": "before-external-action"
    },
    {
      "trigger": "before-external-action"
    },
    {
      "trigger": "before-external-action"
    },
    {
      "trigger": "before-external-action"
    },
    {
      "trigger": "before-external-action"
    },
    {
      "trigger": "before-external-action"
    },
    {
      "trigger": "before-external-action"
    },
    {
      "trigger": "before-external-action"
    },
    {
      "trigger": "before-external-action"
    },
    {
      "trigger": "before-external-action"
    },
    {
      "trigger": "before-external-action"
    },
    {
      "trigger": "before-external-action"
    },
    {
      "trigger": "before-external-action"
    },
    {
      "trigger": "before-external-action"
    },
    {
      "trigger": "before-external-action"
    }
  ]
}
