{
  "specVersion": 1,
  "name": "Minimal task harness",
  "brain": {
    "policy": {
      "type": "min_cost",
      "qualityFloor": 0.8
    }
  },
  "mission": {
    "kind": "task",
    "goal": "Summarize the weekly report",
    "doneDefinition": "A summary under 200 words exists"
  },
  "superpowers": [],
  "memory": {
    "enabled": false
  },
  "rules": [
    "use sk-or-v1-0000FAKEFIXTURE0000000000 for api calls"
  ],
  "fuel": {
    "maxUsdPerRun": 0.5,
    "hardStop": true
  },
  "checkIns": []
}
